{
  "schema_version": "2.0.0",
  "generated_at": "0000-00-00T00:00:00Z",
  "project": "PROJECT_NAME_PLACEHOLDER",
  "quality_summary": {
    "overall_score": 0,
    "domains_tested": 0,
    "domains_total": 0,
    "open_critical": 0,
    "open_high": 0
  },
  "domains": [],
  "issues_by_severity": {
    "critical": 0,
    "high": 0,
    "medium": 0,
    "low": 0,
    "enhancement": 0
  },
  "council_activity": {
    "sessions_total": 0,
    "sessions_last_7_days": 0,
    "open_decisions": 0
  },
  "drift": {
    "stale_domains": [],
    "drift_records_7_days": 0
  }
}
